Dataline,Play,PlayerLinenumber,ActSceneLine,PlayerLine
1545,Henry IV,197,2.4.531,"the morning, and so, good morrow, Peto."
1546,Henry IV,197,,Exeunt
1547,Henry IV,198,2.4.532,"Good morrow, good my lord."
1548,Henry IV,198,2.4.532,ACT III
1549,Henry IV,198,2.4.532,SCENE I. Bangor. The Archdeacon's house.
1550,Henry IV,198,,"Enter HOTSPUR, WORCESTER, MORTIMER, and GLENDOWER"
1551,Henry IV,1,3.1.1,"These promises are fair, the parties sure,"
1552,Henry IV,1,3.1.2,And our induction full of prosperous hope.
1553,Henry IV,2,3.1.3,"Lord Mortimer, and cousin Glendower,"
1554,Henry IV,2,3.1.4,Will you sit down?
1555,Henry IV,2,3.1.5,And uncle Worcester: a plague upon it!
1556,Henry IV,2,3.1.6,I have forgot the map.
1557,Henry IV,3,3.1.7,"No, here it is."
1558,Henry IV,3,3.1.8,"Sit, cousin Percy, sit, good cousin Hotspur,"
1559,Henry IV,3,3.1.9,For by that name as oft as Lancaster
1560,Henry IV,3,3.1.10,"Doth speak of you, his cheek looks pale and with"
1561,Henry IV,3,3.1.11,A rising sigh he wisheth you in heaven.
1562,Henry IV,4,3.1.12,"And you in hell, as oft as he hears Owen Glendower spoke of."
1563,Henry IV,5,3.1.13,I cannot blame him: at my nativity
1564,Henry IV,5,3.1.14,"The front of heaven was full of fiery shapes,"
1565,Henry IV,5,3.1.15,"Of burning cressets, and at my birth"
1566,Henry IV,5,3.1.16,The frame and huge foundation of the earth
1567,Henry IV,5,3.1.17,Shaked like a coward.
1568,Henry IV,6,3.1.18,"Why, so it would have done at the same season, if"
1569,Henry IV,6,3.1.19,"your mother's cat had but kittened, though yourself"
1570,Henry IV,6,3.1.20,had never been born.
1571,Henry IV,7,3.1.21,I say the earth did shake when I was born.
1572,Henry IV,8,3.1.22,"And I say the earth was not of my mind,"
1573,Henry IV,8,3.1.23,If you suppose as fearing you it shook.
1574,Henry IV,9,3.1.24,"The heavens were all on fire, the earth did tremble."
1575,Henry IV,10,3.1.25,"O, then the earth shook to see the heavens on fire,"
1576,Henry IV,10,3.1.26,And not in fear of your nativity.
1577,Henry IV,10,3.1.27,Diseased nature oftentimes breaks forth
1578,Henry IV,10,3.1.28,"In strange eruptions, oft the teeming earth"
1579,Henry IV,10,3.1.29,Is with a kind of colic pinch'd and vex'd
1580,Henry IV,10,3.1.30,By the imprisoning of unruly wind
1581,Henry IV,10,3.1.31,"Within her womb, which, for enlargement striving,"
1582,Henry IV,10,3.1.32,Shakes the old beldam earth and topples down
1583,Henry IV,10,3.1.33,Steeples and moss-grown towers. At your birth
1584,Henry IV,10,3.1.34,"Our grandam earth, having this distemperature,"
1585,Henry IV,10,3.1.35,In passion shook.
1586,Henry IV,11,3.1.36,"Cousin, of many men"
1587,Henry IV,11,3.1.37,I do not bear these crossings. Give me leave
1588,Henry IV,11,3.1.38,To tell you once again that at my birth
1589,Henry IV,11,3.1.39,"The front of heaven was full of fiery shapes,"
1590,Henry IV,11,3.1.40,"The goats ran from the mountains, and the herds"
1591,Henry IV,11,3.1.41,Were strangely clamorous to the frighted fields.
1592,Henry IV,11,3.1.42,"These signs have mark'd me extraordinary,"
1593,Henry IV,11,3.1.43,And all the courses of my life do show
1594,Henry IV,11,3.1.44,I am not in the roll of common men.
1595,Henry IV,11,3.1.45,"Where is he living, clipp'd in with the sea"
1596,Henry IV,11,3.1.46,"That chides the banks of England, Scotland, Wales,"
1597,Henry IV,11,3.1.47,"Which calls me pupil, or hath read to me?"
1598,Henry IV,11,3.1.48,And bring him out that is but woman's son
1599,Henry IV,11,3.1.49,Can trace me in the tedious ways of art
1600,Henry IV,11,3.1.50,And hold me pace in deep experiments.
1601,Henry IV,12,3.1.51,I think there's no man speaks better Welsh.
1602,Henry IV,12,3.1.52,I'll to dinner.
1603,Henry IV,13,3.1.53,"Peace, cousin Percy, you will make him mad."
1604,Henry IV,14,3.1.54,I can call spirits from the vasty deep.
1605,Henry IV,15,3.1.55,"Why, so can I, or so can any man,"
1606,Henry IV,15,3.1.56,But will they come when you do call for them?
1607,Henry IV,16,3.1.57,"Why, I can teach you, cousin, to command"
1608,Henry IV,16,3.1.58,The devil.
1609,Henry IV,17,3.1.59,"And I can teach thee, coz, to shame the devil"
1610,Henry IV,17,3.1.60,By telling truth: tell truth and shame the devil.
1611,Henry IV,17,3.1.61,"If thou have power to raise him, bring him hither,"
1612,Henry IV,17,3.1.62,And I'll be sworn I have power to shame him hence.
1613,Henry IV,17,3.1.63,"O, while you live, tell truth and shame the devil!"
1614,Henry IV,18,3.1.64,"Come, come, no more of this unprofitable chat."
1615,Henry IV,19,3.1.65,Three times hath Henry Bolingbroke made head
1616,Henry IV,19,3.1.66,"Against my power, thrice from the banks of Wye"
1617,Henry IV,19,3.1.67,And sandy-bottom'd Severn have I sent him
1618,Henry IV,19,3.1.68,Bootless home and weather-beaten back.
1619,Henry IV,20,3.1.69,"Home without boots, and in foul weather too!"
1620,Henry IV,20,3.1.70,"How 'scapes he agues, in the devil's name?"
1621,Henry IV,21,3.1.71,"Come, here's the map: shall we divide our right"
1622,Henry IV,21,3.1.72,According to our threefold order ta'en?
1623,Henry IV,22,3.1.73,The archdeacon hath divided it
1624,Henry IV,22,3.1.74,Into three limits very equally:
1625,Henry IV,22,3.1.75,"England, from Trent and Severn hitherto,"
1626,Henry IV,22,3.1.76,By south and east is to my part assign'd:
1627,Henry IV,22,3.1.77,"All westward, Wales beyond the Severn shore,"
1628,Henry IV,22,3.1.78,"And all the fertile land within that bound,"
1629,Henry IV,22,3.1.79,"To Owen Glendower: and, dear coz, to you"
1630,Henry IV,22,3.1.80,"The remnant northward, lying off from Trent."
1631,Henry IV,22,3.1.81,"And our indentures tripartite are drawn,"
1632,Henry IV,22,3.1.82,"Which being sealed interchangeably,"
1633,Henry IV,22,3.1.83,"A business that this night may execute,"
1634,Henry IV,22,3.1.84,"To-morrow, cousin Percy, you and I"
1635,Henry IV,22,3.1.85,And my good Lord of Worcester will set forth
1636,Henry IV,22,3.1.86,"To meet your father and the Scottish power,"
1637,Henry IV,22,3.1.87,"As is appointed us, at Shrewsbury."
1638,Henry IV,22,3.1.88,"My father Glendower is not ready yet,"
1639,Henry IV,22,3.1.89,Not shall we need his help these fourteen days.
1640,Henry IV,22,3.1.90,Within that space you may have drawn together
1641,Henry IV,22,3.1.91,"Your tenants, friends and neighbouring gentlemen."
1642,Henry IV,23,3.1.92,"A shorter time shall send me to you, lords:"
1643,Henry IV,23,3.1.93,"And in my conduct shall your ladies come,"
1644,Henry IV,23,3.1.94,"From whom you now must steal and take no leave,"
1645,Henry IV,23,3.1.95,For there will be a world of water shed
1646,Henry IV,23,3.1.96,Upon the parting of your wives and you.
1647,Henry IV,24,3.1.97,"Methinks my moiety, north from Burton here,"
1648,Henry IV,24,3.1.98,In quantity equals not one of yours:
1649,Henry IV,24,3.1.99,"See how this river comes me cranking in,"
1650,Henry IV,24,3.1.100,And cuts me from the best of all my land
1651,Henry IV,24,3.1.101,"A huge half-moon, a monstrous cantle out."
1652,Henry IV,24,3.1.102,"I'll have the current in this place damm'd up,"
1653,Henry IV,24,3.1.103,And here the smug and silver Trent shall run
1654,Henry IV,24,3.1.104,"In a new channel, fair and evenly,"
1655,Henry IV,24,3.1.105,"It shall not wind with such a deep indent,"
1656,Henry IV,24,3.1.106,To rob me of so rich a bottom here.
1657,Henry IV,25,3.1.107,"Not wind? it shall, it must, you see it doth."
1658,Henry IV,26,3.1.108,"Yea, but"
1659,Henry IV,26,3.1.109,"Mark how he bears his course, and runs me up"
1660,Henry IV,26,3.1.110,"With like advantage on the other side,"
1661,Henry IV,26,3.1.111,Gelding the opposed continent as much
1662,Henry IV,26,3.1.112,As on the other side it takes from you.
1663,Henry IV,27,3.1.113,"Yea, but a little charge will trench him here"
1664,Henry IV,27,3.1.114,"And on this north side win this cape of land,"
1665,Henry IV,27,3.1.115,And then he runs straight and even.
1666,Henry IV,28,3.1.116,I'll have it so: a little charge will do it.
1667,Henry IV,29,3.1.117,I'll not have it alter'd.
1668,Henry IV,30,3.1.118,Will not you?
1669,Henry IV,31,3.1.119,"No, nor you shall not."
1670,Henry IV,32,3.1.120,Who shall say me nay?
1671,Henry IV,33,3.1.121,"Why, that will I."
1672,Henry IV,34,3.1.122,"Let me not understand you, then, speak it in Welsh."
1673,Henry IV,35,3.1.123,"I can speak English, lord, as well as you,"
1674,Henry IV,35,3.1.124,"For I was train'd up in the English court,"
1675,Henry IV,35,3.1.125,"Where, being but young, I framed to the harp"
1676,Henry IV,35,3.1.126,Many an English ditty lovely well
1677,Henry IV,35,3.1.127,"And gave the tongue a helpful ornament,"
1678,Henry IV,35,3.1.128,A virtue that was never seen in you.
1679,Henry IV,36,3.1.129,"Marry,"
1680,Henry IV,36,3.1.130,And I am glad of it with all my heart:
1681,Henry IV,36,3.1.131,I had rather be a kitten and cry mew
1682,Henry IV,36,3.1.132,"Than one of these same metre ballad-mongers,"
1683,Henry IV,36,3.1.133,"I had rather hear a brazen canstick turn'd,"
1684,Henry IV,36,3.1.134,"Or a dry wheel grate on the axle-tree,"
1685,Henry IV,36,3.1.135,"And that would set my teeth nothing on edge,"
1686,Henry IV,36,3.1.136,Nothing so much as mincing poetry:
1687,Henry IV,36,3.1.137,'Tis like the forced gait of a shuffling nag.
1688,Henry IV,37,3.1.138,"Come, you shall have Trent turn'd."
1689,Henry IV,38,3.1.139,I do not care: I'll give thrice so much land
1690,Henry IV,38,3.1.140,"To any well-deserving friend,"
1691,Henry IV,38,3.1.141,"But in the way of bargain, mark ye me,"
1692,Henry IV,38,3.1.142,I'll cavil on the ninth part of a hair.
1693,Henry IV,38,3.1.143,Are the indentures drawn? shall we be gone?
1694,Henry IV,39,3.1.144,"The moon shines fair, you may away by night:"
1695,Henry IV,39,3.1.145,I'll haste the writer and withal
1696,Henry IV,39,3.1.146,Break with your wives of your departure hence:
1697,Henry IV,39,3.1.147,"I am afraid my daughter will run mad,"
1698,Henry IV,39,3.1.148,So much she doteth on her Mortimer.
1699,Henry IV,39,,Exit GLENDOWER
1700,Henry IV,40,3.1.149,"Fie, cousin Percy! how you cross my father!"
1701,Henry IV,41,3.1.150,I cannot choose: sometime he angers me
1702,Henry IV,41,3.1.151,"With telling me of the mouldwarp and the ant,"
1703,Henry IV,41,3.1.152,"Of the dreamer Merlin and his prophecies,"
1704,Henry IV,41,3.1.153,"And of a dragon and a finless fish,"
1705,Henry IV,41,3.1.154,"A clip-wing'd griffin and a moulten raven,"
1706,Henry IV,41,3.1.155,"A couching lion and a ramping cat,"
1707,Henry IV,41,3.1.156,And such a deal of skimble-skamble stuff
1708,Henry IV,41,3.1.157,"As puts me from my faith. I tell you what,"
1709,Henry IV,41,3.1.158,He held me last night at least nine hours
1710,Henry IV,41,3.1.159,In reckoning up the several devils' names
1711,Henry IV,41,3.1.160,"That were his lackeys: I cried 'hum,' and 'well, go to,'"
1712,Henry IV,41,3.1.161,"But mark'd him not a word. O, he is as tedious"
1713,Henry IV,41,3.1.162,"As a tired horse, a railing wife,"
1714,Henry IV,41,3.1.163,Worse than a smoky house: I had rather live
1715,Henry IV,41,3.1.164,"With cheese and garlic in a windmill, far,"
1716,Henry IV,41,3.1.165,Than feed on cates and have him talk to me
1717,Henry IV,41,3.1.166,In any summer-house in Christendom.
1718,Henry IV,42,3.1.167,"In faith, he is a worthy gentleman,"
1719,Henry IV,42,3.1.168,"Exceedingly well read, and profited"
1720,Henry IV,42,3.1.169,"In strange concealments, valiant as a lion"
1721,Henry IV,42,3.1.170,And as wondrous affable and as bountiful
1722,Henry IV,42,3.1.171,"As mines of India. Shall I tell you, cousin?"
1723,Henry IV,42,3.1.172,He holds your temper in a high respect
1724,Henry IV,42,3.1.173,And curbs himself even of his natural scope
1725,Henry IV,42,3.1.174,"When you come 'cross his humour, faith, he does:"
1726,Henry IV,42,3.1.175,"I warrant you, that man is not alive"
1727,Henry IV,42,3.1.176,"Might so have tempted him as you have done,"
1728,Henry IV,42,3.1.177,Without the taste of danger and reproof:
1729,Henry IV,42,3.1.178,"But do not use it oft, let me entreat you."
1730,Henry IV,43,3.1.179,"In faith, my lord, you are too wilful-blame,"
1731,Henry IV,43,3.1.180,And since your coming hither have done enough
1732,Henry IV,43,3.1.181,To put him quite beside his patience.
1733,Henry IV,43,3.1.182,"You must needs learn, lord, to amend this fault:"
1734,Henry IV,43,3.1.183,"Though sometimes it show greatness, courage, blood,--"
1735,Henry IV,43,3.1.184,"And that's the dearest grace it renders you,--"
1736,Henry IV,43,3.1.185,"Yet oftentimes it doth present harsh rage,"
1737,Henry IV,43,3.1.186,"Defect of manners, want of government,"
1738,Henry IV,43,3.1.187,"Pride, haughtiness, opinion and disdain:"
1739,Henry IV,43,3.1.188,The least of which haunting a nobleman
1740,Henry IV,43,3.1.189,Loseth men's hearts and leaves behind a stain
1741,Henry IV,43,3.1.190,"Upon the beauty of all parts besides,"
1742,Henry IV,43,3.1.191,Beguiling them of commendation.
1743,Henry IV,44,3.1.192,"Well, I am school'd: good manners be your speed!"
1744,Henry IV,44,3.1.193,"Here come our wives, and let us take our leave."
1745,Henry IV,44,,Re-enter GLENDOWER with the ladies
1746,Henry IV,45,3.1.194,"This is the deadly spite that angers me,"
1747,Henry IV,45,3.1.195,"My wife can speak no English, I no Welsh."
1748,Henry IV,46,3.1.196,"My daughter weeps: she will not part with you,"
1749,Henry IV,46,3.1.197,"She'll be a soldier too, she'll to the wars."
1750,Henry IV,47,3.1.198,"Good father, tell her that she and my aunt Percy"
1751,Henry IV,47,3.1.199,Shall follow in your conduct speedily.
1752,Henry IV,47,,"Glendower speaks to her in Welsh, and she answers him in the same"
1753,Henry IV,48,3.1.200,"She is desperate here, a peevish self-wind harlotry,"
1754,Henry IV,48,3.1.201,one that no persuasion can do good upon.
1755,Henry IV,48,,The lady speaks in Welsh
1756,Henry IV,49,3.1.202,I understand thy looks: that pretty Welsh
1757,Henry IV,49,3.1.203,Which thou pour'st down from these swelling heavens
1758,Henry IV,49,3.1.204,"I am too perfect in, and, but for shame,"
1759,Henry IV,49,3.1.205,In such a parley should I answer thee.
1760,Henry IV,49,,The lady speaks again in Welsh
1761,Henry IV,49,3.1.206,"I understand thy kisses and thou mine,"
1762,Henry IV,49,3.1.207,And that's a feeling disputation:
1763,Henry IV,49,3.1.208,"But I will never be a truant, love,"
1764,Henry IV,49,3.1.209,"Till I have learned thy language, for thy tongue"
1765,Henry IV,49,3.1.210,"Makes Welsh as sweet as ditties highly penn'd,"
1766,Henry IV,49,3.1.211,"Sung by a fair queen in a summer's bower,"
1767,Henry IV,49,3.1.212,"With ravishing division, to her lute."
1768,Henry IV,50,3.1.213,"Nay, if you melt, then will she run mad."
1769,Henry IV,50,,The lady speaks again in Welsh
1770,Henry IV,51,3.1.214,"O, I am ignorance itself in this!"
1771,Henry IV,52,3.1.215,She bids you on the wanton rushes lay you down
1772,Henry IV,52,3.1.216,"And rest your gentle head upon her lap,"
1773,Henry IV,52,3.1.217,And she will sing the song that pleaseth you
1774,Henry IV,52,3.1.218,And on your eyelids crown the god of sleep.
1775,Henry IV,52,3.1.219,"Charming your blood with pleasing heaviness,"
1776,Henry IV,52,3.1.220,Making such difference 'twixt wake and sleep
1777,Henry IV,52,3.1.221,As is the difference betwixt day and night
1778,Henry IV,52,3.1.222,The hour before the heavenly-harness'd team
1779,Henry IV,52,3.1.223,Begins his golden progress in the east.
1780,Henry IV,53,3.1.224,With all my heart I'll sit and hear her sing:
1781,Henry IV,53,3.1.225,"By that time will our book, I think, be drawn"
1782,Henry IV,54,3.1.226,"Do so,"
1783,Henry IV,54,3.1.227,And those musicians that shall play to you
1784,Henry IV,54,3.1.228,"Hang in the air a thousand leagues from hence,"
1785,Henry IV,54,3.1.229,"And straight they shall be here: sit, and attend."
1786,Henry IV,55,3.1.230,"Come, Kate, thou art perfect in lying down: come,"
1787,Henry IV,55,3.1.231,"quick, quick, that I may lay my head in thy lap."
1788,Henry IV,56,3.1.232,"Go, ye giddy goose."
1789,Henry IV,56,,The music plays
1790,Henry IV,57,3.1.233,"Now I perceive the devil understands Welsh,"
1791,Henry IV,57,3.1.234,And 'tis no marvel he is so humorous.
1792,Henry IV,57,3.1.235,"By'r lady, he is a good musician."
1793,Henry IV,58,3.1.236,Then should you be nothing but musical for you are
1794,Henry IV,58,3.1.237,"altogether governed by humours. Lie still, ye thief,"
1795,Henry IV,58,3.1.238,and hear the lady sing in Welsh.
1796,Henry IV,59,3.1.239,"I had rather hear Lady, my brach, howl in Irish."
1797,Henry IV,60,3.1.240,Wouldst thou have thy head broken?
1798,Henry IV,61,3.1.241,No.
1799,Henry IV,62,3.1.242,Then be still.
1800,Henry IV,63,3.1.243,"Neither,'tis a woman's fault."
1801,Henry IV,64,3.1.244,Now God help thee!
1802,Henry IV,65,3.1.245,To the Welsh lady's bed.
1803,Henry IV,66,3.1.246,What's that?
1804,Henry IV,67,3.1.247,Peace! she sings.
1805,Henry IV,67,,Here the lady sings a Welsh song
1806,Henry IV,68,3.1.248,"Come, Kate, I'll have your song too."
1807,Henry IV,69,3.1.249,"Not mine, in good sooth."
1808,Henry IV,70,3.1.250,"Not yours, in good sooth! Heart! you swear like a"
1809,Henry IV,70,3.1.251,"comfit-maker's wife. 'Not you, in good sooth,' and"
1810,Henry IV,70,3.1.252,"'as true as I live,' and 'as God shall mend me,' and"
1811,Henry IV,70,3.1.253,"'as sure as day,'"
1812,Henry IV,70,3.1.254,"And givest such sarcenet surety for thy oaths,"
1813,Henry IV,70,3.1.255,As if thou never walk'st further than Finsbury.
1814,Henry IV,70,3.1.256,"Swear me, Kate, like a lady as thou art,"
1815,Henry IV,70,3.1.257,"A good mouth-filling oath, and leave 'in sooth,'"
1816,Henry IV,70,3.1.258,"And such protest of pepper-gingerbread,"
1817,Henry IV,70,3.1.259,To velvet-guards and Sunday-citizens.
1818,Henry IV,70,3.1.260,"Come, sing."
1819,Henry IV,71,3.1.261,I will not sing.
1820,Henry IV,72,3.1.262,"'Tis the next way to turn tailor, or be red-breast"
1821,Henry IV,72,3.1.263,"teacher. An the indentures be drawn, I'll away"
1822,Henry IV,72,3.1.264,"within these two hours, and so, come in when ye will."
1823,Henry IV,72,,Exit
1824,Henry IV,73,3.1.265,"Come, come, Lord Mortimer, you are as slow"
1825,Henry IV,73,3.1.266,As hot Lord Percy is on fire to go.
1826,Henry IV,73,3.1.267,"By this our book is drawn, we'll but seal,"
1827,Henry IV,73,3.1.268,And then to horse immediately.
1828,Henry IV,74,3.1.269,With all my heart.
1829,Henry IV,74,,Exeunt
1830,Henry IV,74,,SCENE II. London. The palace.
1831,Henry IV,74,,"Enter KING HENRY IV, PRINCE HENRY, and others"
1832,Henry IV,1,3.2.1,"Lords, give us leave, the Prince of Wales and I"
1833,Henry IV,1,3.2.2,"Must have some private conference, but be near at hand,"
1834,Henry IV,1,3.2.3,For we shall presently have need of you.
1835,Henry IV,1,,Exeunt Lords
1836,Henry IV,1,3.2.4,"I know not whether God will have it so,"
1837,Henry IV,1,3.2.5,"For some displeasing service I have done,"
1838,Henry IV,1,3.2.6,"That, in his secret doom, out of my blood"
1839,Henry IV,1,3.2.7,"He'll breed revengement and a scourge for me,"
1840,Henry IV,1,3.2.8,But thou dost in thy passages of life
1841,Henry IV,1,3.2.9,Make me believe that thou art only mark'd
1842,Henry IV,1,3.2.10,For the hot vengeance and the rod of heaven
1843,Henry IV,1,3.2.11,"To punish my mistreadings. Tell me else,"
1844,Henry IV,1,3.2.12,"Could such inordinate and low desires,"
1845,Henry IV,1,3.2.13,"Such poor, such bare, such lewd, such mean attempts,"
1846,Henry IV,1,3.2.14,"Such barren pleasures, rude society,"
1847,Henry IV,1,3.2.15,"As thou art match'd withal and grafted to,"
1848,Henry IV,1,3.2.16,Accompany the greatness of thy blood
1849,Henry IV,1,3.2.17,And hold their level with thy princely heart?
1850,Henry IV,2,3.2.18,"So please your majesty, I would I could"
1851,Henry IV,2,3.2.19,Quit all offences with as clear excuse
1852,Henry IV,2,3.2.20,As well as I am doubtless I can purge
1853,Henry IV,2,3.2.21,Myself of many I am charged withal:
1854,Henry IV,2,3.2.22,"Yet such extenuation let me beg,"
1855,Henry IV,2,3.2.23,"As, in reproof of many tales devised,"
1856,Henry IV,2,3.2.24,"which oft the ear of greatness needs must hear,"
1857,Henry IV,2,3.2.25,"By smiling pick-thanks and base news-mongers,"
1858,Henry IV,2,3.2.26,"I may, for some things true, wherein my youth"
1859,Henry IV,2,3.2.27,"Hath faulty wander'd and irregular,"
1860,Henry IV,2,3.2.28,Find pardon on my true submission.
1861,Henry IV,3,3.2.29,"God pardon thee! yet let me wonder, Harry,"
1862,Henry IV,3,3.2.30,"At thy affections, which do hold a wing"
1863,Henry IV,3,3.2.31,Quite from the flight of all thy ancestors.
1864,Henry IV,3,3.2.32,Thy place in council thou hast rudely lost.
1865,Henry IV,3,3.2.33,"Which by thy younger brother is supplied,"
1866,Henry IV,3,3.2.34,And art almost an alien to the hearts
1867,Henry IV,3,3.2.35,Of all the court and princes of my blood:
1868,Henry IV,3,3.2.36,The hope and expectation of thy time
1869,Henry IV,3,3.2.37,"Is ruin'd, and the soul of every man"
1870,Henry IV,3,3.2.38,Prophetically doth forethink thy fall.
1871,Henry IV,3,3.2.39,"Had I so lavish of my presence been,"
1872,Henry IV,3,3.2.40,"So common-hackney'd in the eyes of men,"
1873,Henry IV,3,3.2.41,"So stale and cheap to vulgar company,"
1874,Henry IV,3,3.2.42,"Opinion, that did help me to the crown,"
1875,Henry IV,3,3.2.43,Had still kept loyal to possession
1876,Henry IV,3,3.2.44,"And left me in reputeless banishment,"
1877,Henry IV,3,3.2.45,A fellow of no mark nor likelihood.
1878,Henry IV,3,3.2.46,"By being seldom seen, I could not stir"
1879,Henry IV,3,3.2.47,"But like a comet I was wonder'd at,"
1880,Henry IV,3,3.2.48,"That men would tell their children 'This is he,'"
1881,Henry IV,3,3.2.49,"Others would say 'Where, which is Bolingbroke?'"
1882,Henry IV,3,3.2.50,"And then I stole all courtesy from heaven,"
1883,Henry IV,3,3.2.51,And dress'd myself in such humility
1884,Henry IV,3,3.2.52,"That I did pluck allegiance from men's hearts,"
1885,Henry IV,3,3.2.53,"Loud shouts and salutations from their mouths,"
1886,Henry IV,3,3.2.54,Even in the presence of the crowned king.
1887,Henry IV,3,3.2.55,"Thus did I keep my person fresh and new,"
1888,Henry IV,3,3.2.56,"My presence, like a robe pontifical,"
1889,Henry IV,3,3.2.57,"Ne'er seen but wonder'd at: and so my state,"
1890,Henry IV,3,3.2.58,"Seldom but sumptuous, showed like a feast"
1891,Henry IV,3,3.2.59,And won by rareness such solemnity.
1892,Henry IV,3,3.2.60,"The skipping king, he ambled up and down"
1893,Henry IV,3,3.2.61,"With shallow jesters and rash bavin wits,"
1894,Henry IV,3,3.2.62,"Soon kindled and soon burnt, carded his state,"
1895,Henry IV,3,3.2.63,"Mingled his royalty with capering fools,"
1896,Henry IV,3,3.2.64,Had his great name profaned with their scorns
1897,Henry IV,3,3.2.65,"And gave his countenance, against his name,"
1898,Henry IV,3,3.2.66,To laugh at gibing boys and stand the push
1899,Henry IV,3,3.2.67,"Of every beardless vain comparative,"
1900,Henry IV,3,3.2.68,"Grew a companion to the common streets,"
1901,Henry IV,3,3.2.69,"Enfeoff'd himself to popularity,"
1902,Henry IV,3,3.2.70,"That, being daily swallow'd by men's eyes,"
1903,Henry IV,3,3.2.71,They surfeited with honey and began
1904,Henry IV,3,3.2.72,"To loathe the taste of sweetness, whereof a little"
1905,Henry IV,3,3.2.73,More than a little is by much too much.
1906,Henry IV,3,3.2.74,"So when he had occasion to be seen,"
1907,Henry IV,3,3.2.75,"He was but as the cuckoo is in June,"
1908,Henry IV,3,3.2.76,"Heard, not regarded, seen, but with such eyes"
1909,Henry IV,3,3.2.77,"As, sick and blunted with community,"
1910,Henry IV,3,3.2.78,"Afford no extraordinary gaze,"
1911,Henry IV,3,3.2.79,Such as is bent on sun-like majesty
1912,Henry IV,3,3.2.80,"When it shines seldom in admiring eyes,"
1913,Henry IV,3,3.2.81,"But rather drowzed and hung their eyelids down,"
1914,Henry IV,3,3.2.82,Slept in his face and render'd such aspect
1915,Henry IV,3,3.2.83,"As cloudy men use to their adversaries,"
1916,Henry IV,3,3.2.84,"Being with his presence glutted, gorged and full."
1917,Henry IV,3,3.2.85,"And in that very line, Harry, standest thou,"
1918,Henry IV,3,3.2.86,For thou has lost thy princely privilege
1919,Henry IV,3,3.2.87,With vile participation: not an eye
1920,Henry IV,3,3.2.88,"But is a-weary of thy common sight,"
1921,Henry IV,3,3.2.89,"Save mine, which hath desired to see thee more,"
1922,Henry IV,3,3.2.90,"Which now doth that I would not have it do,"
1923,Henry IV,3,3.2.91,Make blind itself with foolish tenderness.
1924,Henry IV,4,3.2.92,"I shall hereafter, my thrice gracious lord,"
1925,Henry IV,4,3.2.93,Be more myself.
1926,Henry IV,5,3.2.94,For all the world
1927,Henry IV,5,3.2.95,As thou art to this hour was Richard then
1928,Henry IV,5,3.2.96,"When I from France set foot at Ravenspurgh,"
1929,Henry IV,5,3.2.97,And even as I was then is Percy now.
1930,Henry IV,5,3.2.98,"Now, by my sceptre and my soul to boot,"
1931,Henry IV,5,3.2.99,He hath more worthy interest to the state
1932,Henry IV,5,3.2.100,"Than thou the shadow of succession,"
1933,Henry IV,5,3.2.101,"For of no right, nor colour like to right,"
1934,Henry IV,5,3.2.102,"He doth fill fields with harness in the realm,"
1935,Henry IV,5,3.2.103,"Turns head against the lion's armed jaws,"
1936,Henry IV,5,3.2.104,"And, being no more in debt to years than thou,"
1937,Henry IV,5,3.2.105,Leads ancient lords and reverend bishops on
1938,Henry IV,5,3.2.106,To bloody battles and to bruising arms.
1939,Henry IV,5,3.2.107,What never-dying honour hath he got
