Dataline,Play,PlayerLinenumber,ActSceneLine,PlayerLine
1177,Henry IV,68,2.4.174,"And unbound the rest, and then come in the other."
1178,Henry IV,69,2.4.175,"What, fought you with them all?"
1179,Henry IV,70,2.4.176,"All! I know not what you call all, but if I fought"
1180,Henry IV,70,2.4.177,"not with fifty of them, I am a bunch of radish: if"
1181,Henry IV,70,2.4.178,there were not two or three and fifty upon poor old
1182,Henry IV,70,2.4.179,"Jack, then am I no two-legged creature."
1183,Henry IV,71,2.4.180,Pray God you have not murdered some of them.
1184,Henry IV,72,2.4.181,"Nay, that's past praying for: I have peppered two"
1185,Henry IV,72,2.4.182,"of them, two I am sure I have paid, two rogues"
1186,Henry IV,72,2.4.183,"in buckram suits. I tell thee what, Hal, if I tell"
1187,Henry IV,72,2.4.184,"thee a lie, spit in my face, call me horse. Thou"
1188,Henry IV,72,2.4.185,"knowest my old ward, here I lay and thus I bore my"
1189,Henry IV,72,2.4.186,point. Four rogues in buckram let drive at me--
1190,Henry IV,73,2.4.187,"What, four? thou saidst but two even now."
1191,Henry IV,74,2.4.188,"Four, Hal, I told thee four."
1192,Henry IV,75,2.4.189,"Ay, ay, he said four."
1193,Henry IV,76,2.4.190,"These four came all a-front, and mainly thrust at"
1194,Henry IV,76,2.4.191,me. I made me no more ado but took all their seven
1195,Henry IV,76,2.4.192,"points in my target, thus."
1196,Henry IV,77,2.4.193,"Seven? why, there were but four even now."
1197,Henry IV,78,2.4.194,In buckram?
1198,Henry IV,79,2.4.195,"Ay, four, in buckram suits."
1199,Henry IV,80,2.4.196,"Seven, by these hilts, or I am a villain else."
1200,Henry IV,81,2.4.197,"Prithee, let him alone, we shall have more anon."
1201,Henry IV,82,2.4.198,"Dost thou hear me, Hal?"
1202,Henry IV,83,2.4.199,"Ay, and mark thee too, Jack."
1203,Henry IV,84,2.4.200,"Do so, for it is worth the listening to. These nine"
1204,Henry IV,84,2.4.201,in buckram that I told thee of--
1205,Henry IV,85,2.4.202,"So, two more already."
1206,Henry IV,86,2.4.203,"Their points being broken,--"
1207,Henry IV,87,2.4.204,Down fell their hose.
1208,Henry IV,88,2.4.205,"Began to give me ground: but I followed me close,"
1209,Henry IV,88,2.4.206,"came in foot and hand, and with a thought seven of"
1210,Henry IV,88,2.4.207,the eleven I paid.
1211,Henry IV,89,2.4.208,O monstrous! eleven buckram men grown out of two!
1212,Henry IV,90,2.4.209,"But, as the devil would have it, three misbegotten"
1213,Henry IV,90,2.4.210,knaves in Kendal green came at my back and let drive
1214,Henry IV,90,2.4.211,"at me, for it was so dark, Hal, that thou couldst"
1215,Henry IV,90,2.4.212,not see thy hand.
1216,Henry IV,91,2.4.213,"These lies are like their father that begets them,"
1217,Henry IV,91,2.4.214,"gross as a mountain, open, palpable. Why, thou"
1218,Henry IV,91,2.4.215,"clay-brained guts, thou knotty-pated fool, thou"
1219,Henry IV,91,2.4.216,"whoreson, obscene, grease tallow-catch,--"
1220,Henry IV,92,2.4.217,"What, art thou mad? art thou mad? is not the truth"
1221,Henry IV,92,2.4.218,the truth?
1222,Henry IV,93,2.4.219,"Why, how couldst thou know these men in Kendal"
1223,Henry IV,93,2.4.220,"green, when it was so dark thou couldst not see thy"
1224,Henry IV,93,2.4.221,"hand? come, tell us your reason: what sayest thou to this?"
1225,Henry IV,94,2.4.222,"Come, your reason, Jack, your reason."
1226,Henry IV,95,2.4.223,"What, upon compulsion? 'Zounds, an I were at the"
1227,Henry IV,95,2.4.224,"strappado, or all the racks in the world, I would"
1228,Henry IV,95,2.4.225,not tell you on compulsion. Give you a reason on
1229,Henry IV,95,2.4.226,compulsion! If reasons were as plentiful as
1230,Henry IV,95,2.4.227,"blackberries, I would give no man a reason upon"
1231,Henry IV,95,2.4.228,"compulsion, I."
1232,Henry IV,96,2.4.229,"I'll be no longer guilty of this sin, this sanguine"
1233,Henry IV,96,2.4.230,"coward, this bed-presser, this horseback-breaker,"
1234,Henry IV,96,2.4.231,"this huge hill of flesh,--"
1235,Henry IV,97,2.4.232,"'Sblood, you starveling, you elf-skin, you dried"
1236,Henry IV,97,2.4.233,"neat's tongue, you bull's pizzle, you stock-fish! O"
1237,Henry IV,97,2.4.234,for breath to utter what is like thee! you
1238,Henry IV,97,2.4.235,"tailor's-yard, you sheath, you bowcase, you vile"
1239,Henry IV,97,2.4.236,"standing-tuck,--"
1240,Henry IV,98,2.4.237,"Well, breathe awhile, and then to it again: and"
1241,Henry IV,98,2.4.238,"when thou hast tired thyself in base comparisons,"
1242,Henry IV,98,2.4.239,hear me speak but this.
1243,Henry IV,99,2.4.240,"Mark, Jack."
1244,Henry IV,100,2.4.241,"We two saw you four set on four and bound them, and"
1245,Henry IV,100,2.4.242,"were masters of their wealth. Mark now, how a plain"
1246,Henry IV,100,2.4.243,tale shall put you down. Then did we two set on you
1247,Henry IV,100,2.4.244,"four, and, with a word, out-faced you from your"
1248,Henry IV,100,2.4.245,"prize, and have it, yea, and can show it you here in"
1249,Henry IV,100,2.4.246,"the house: and, Falstaff, you carried your guts"
1250,Henry IV,100,2.4.247,"away as nimbly, with as quick dexterity, and roared"
1251,Henry IV,100,2.4.248,"for mercy and still run and roared, as ever I heard"
1252,Henry IV,100,2.4.249,"bull-calf. What a slave art thou, to hack thy sword"
1253,Henry IV,100,2.4.250,"as thou hast done, and then say it was in fight!"
1254,Henry IV,100,2.4.251,"What trick, what device, what starting-hole, canst"
1255,Henry IV,100,2.4.252,thou now find out to hide thee from this open and
1256,Henry IV,100,2.4.253,apparent shame?
1257,Henry IV,101,2.4.254,"Come, let's hear, Jack, what trick hast thou now?"
1258,Henry IV,102,2.4.255,"By the Lord, I knew ye as well as he that made ye."
1259,Henry IV,102,2.4.256,"Why, hear you, my masters: was it for me to kill the"
1260,Henry IV,102,2.4.257,heir-apparent? should I turn upon the true prince?
1261,Henry IV,102,2.4.258,"why, thou knowest I am as valiant as Hercules: but"
1262,Henry IV,102,2.4.259,"beware instinct, the lion will not touch the true"
1263,Henry IV,102,2.4.260,"prince. Instinct is a great matter, I was now a"
1264,Henry IV,102,2.4.261,coward on instinct. I shall think the better of
1265,Henry IV,102,2.4.262,"myself and thee during my life, I for a valiant"
1266,Henry IV,102,2.4.263,"lion, and thou for a true prince. But, by the Lord,"
1267,Henry IV,102,2.4.264,"lads, I am glad you have the money. Hostess, clap"
1268,Henry IV,102,2.4.265,"to the doors: watch to-night, pray to-morrow."
1269,Henry IV,102,2.4.266,"Gallants, lads, boys, hearts of gold, all the titles"
1270,Henry IV,102,2.4.267,"of good fellowship come to you! What, shall we be"
1271,Henry IV,102,2.4.268,merry? shall we have a play extempore?
1272,Henry IV,103,2.4.269,"Content, and the argument shall be thy running away."
1273,Henry IV,104,2.4.270,"Ah, no more of that, Hal, an thou lovest me!"
1274,Henry IV,104,,Enter Hostess
1275,Henry IV,105,2.4.271,"O Jesu, my lord the prince!"
1276,Henry IV,106,2.4.272,"How now, my lady the hostess! what sayest thou to"
1277,Henry IV,106,2.4.273,me?
1278,Henry IV,107,2.4.274,"Marry, my lord, there is a nobleman of the court at"
1279,Henry IV,107,2.4.275,door would speak with you: he says he comes from
1280,Henry IV,107,2.4.276,your father.
1281,Henry IV,108,2.4.277,"Give him as much as will make him a royal man, and"
1282,Henry IV,108,2.4.278,send him back again to my mother.
1283,Henry IV,109,2.4.279,What manner of man is he?
1284,Henry IV,110,2.4.280,An old man.
1285,Henry IV,111,2.4.281,What doth gravity out of his bed at midnight? Shall
1286,Henry IV,111,2.4.282,I give him his answer?
1287,Henry IV,112,2.4.283,"Prithee, do, Jack."
1288,Henry IV,113,2.4.284,"'Faith, and I'll send him packing."
1289,Henry IV,113,,Exit FALSTAFF
1290,Henry IV,114,2.4.285,"Now, sirs: by'r lady, you fought fair, so did you,"
1291,Henry IV,114,2.4.286,"Peto, so did you, Bardolph: you are lions too, you"
1292,Henry IV,114,2.4.287,"ran away upon instinct, you will not touch the true"
1293,Henry IV,114,2.4.288,"prince, no, fie!"
1294,Henry IV,115,2.4.289,"'Faith, I ran when I saw others run."
1295,Henry IV,116,2.4.290,"'Faith, tell me now in earnest, how came Falstaff's"
1296,Henry IV,116,2.4.291,sword so hacked?
1297,Henry IV,117,2.4.292,"Why, he hacked it with his dagger, and said he would"
1298,Henry IV,117,2.4.293,swear truth out of England but he would make you
1299,Henry IV,117,2.4.294,"believe it was done in fight, and persuaded us to do the like."
1300,Henry IV,118,2.4.295,"Yea, and to tickle our noses with spear-grass to"
1301,Henry IV,118,2.4.296,"make them bleed, and then to beslubber our garments"
1302,Henry IV,118,2.4.297,with it and swear it was the blood of true men. I
1303,Henry IV,118,2.4.298,"did that I did not this seven year before, I blushed"
1304,Henry IV,118,2.4.299,to hear his monstrous devices.
1305,Henry IV,119,2.4.300,"O villain, thou stolest a cup of sack eighteen years"
1306,Henry IV,119,2.4.301,"ago, and wert taken with the manner, and ever since"
1307,Henry IV,119,2.4.302,thou hast blushed extempore. Thou hadst fire and
1308,Henry IV,119,2.4.303,"sword on thy side, and yet thou rannest away: what"
1309,Henry IV,119,2.4.304,instinct hadst thou for it?
1310,Henry IV,120,2.4.305,"My lord, do you see these meteors? do you behold"
1311,Henry IV,120,2.4.306,these exhalations?
1312,Henry IV,121,2.4.307,I do.
1313,Henry IV,122,2.4.308,What think you they portend?
1314,Henry IV,123,2.4.309,Hot livers and cold purses.
1315,Henry IV,124,2.4.310,"Choler, my lord, if rightly taken."
1316,Henry IV,125,2.4.311,"No, if rightly taken, halter."
1317,Henry IV,125,,Re-enter FALSTAFF
1318,Henry IV,125,2.4.312,"Here comes lean Jack, here comes bare-bone."
1319,Henry IV,125,2.4.313,"How now, my sweet creature of bombast!"
1320,Henry IV,125,2.4.314,"How long is't ago, Jack, since thou sawest thine own knee?"
1321,Henry IV,126,2.4.315,"My own knee! when I was about thy years, Hal, I was"
1322,Henry IV,126,2.4.316,"not an eagle's talon in the waist, I could have"
1323,Henry IV,126,2.4.317,crept into any alderman's thumb-ring: a plague of
1324,Henry IV,126,2.4.318,sighing and grief! it blows a man up like a
1325,Henry IV,126,2.4.319,bladder. There's villanous news abroad: here was
1326,Henry IV,126,2.4.320,"Sir John Bracy from your father, you must to the"
1327,Henry IV,126,2.4.321,court in the morning. That same mad fellow of the
1328,Henry IV,126,2.4.322,"north, Percy, and he of Wales, that gave Amamon the"
1329,Henry IV,126,2.4.323,bastinado and made Lucifer cuckold and swore the
1330,Henry IV,126,2.4.324,devil his true liegeman upon the cross of a Welsh
1331,Henry IV,126,2.4.325,hook--what a plague call you him?
1332,Henry IV,127,2.4.326,"O, Glendower."
1333,Henry IV,128,2.4.327,"Owen, Owen, the same, and his son-in-law Mortimer,"
1334,Henry IV,128,2.4.328,"and old Northumberland, and that sprightly Scot of"
1335,Henry IV,128,2.4.329,"Scots, Douglas, that runs o' horseback up a hill"
1336,Henry IV,128,2.4.330,"perpendicular,--"
1337,Henry IV,129,2.4.331,He that rides at high speed and with his pistol
1338,Henry IV,129,2.4.332,kills a sparrow flying.
1339,Henry IV,130,2.4.333,You have hit it.
1340,Henry IV,131,2.4.334,So did he never the sparrow.
1341,Henry IV,132,2.4.335,"Well, that rascal hath good mettle in him, he will not run."
1342,Henry IV,133,2.4.336,"Why, what a rascal art thou then, to praise him so"
1343,Henry IV,133,2.4.337,for running!
1344,Henry IV,134,2.4.338,"O' horseback, ye cuckoo, but afoot he will not budge a foot."
1345,Henry IV,135,2.4.339,"Yes, Jack, upon instinct."
1346,Henry IV,136,2.4.340,"I grant ye, upon instinct. Well, he is there too,"
1347,Henry IV,136,2.4.341,"and one Mordake, and a thousand blue-caps more:"
1348,Henry IV,136,2.4.342,"Worcester is stolen away to-night, thy father's"
1349,Henry IV,136,2.4.343,beard is turned white with the news: you may buy
1350,Henry IV,136,2.4.344,land now as cheap as stinking mackerel.
1351,Henry IV,137,2.4.345,"Why, then, it is like, if there come a hot June and"
1352,Henry IV,137,2.4.346,"this civil buffeting hold, we shall buy maidenheads"
1353,Henry IV,137,2.4.347,"as they buy hob-nails, by the hundreds."
1354,Henry IV,138,2.4.348,"By the mass, lad, thou sayest true, it is like we"
1355,Henry IV,138,2.4.349,"shall have good trading that way. But tell me, Hal,"
1356,Henry IV,138,2.4.350,art not thou horrible afeard? thou being
1357,Henry IV,138,2.4.351,"heir-apparent, could the world pick thee out three"
1358,Henry IV,138,2.4.352,"such enemies again as that fiend Douglas, that"
1359,Henry IV,138,2.4.353,"spirit Percy, and that devil Glendower? Art thou"
1360,Henry IV,138,2.4.354,not horribly afraid? doth not thy blood thrill at
1361,Henry IV,138,2.4.355,it?
1362,Henry IV,139,2.4.356,"Not a whit, i' faith, I lack some of thy instinct."
1363,Henry IV,140,2.4.357,"Well, thou wert be horribly chid tomorrow when thou"
1364,Henry IV,140,2.4.358,"comest to thy father: if thou love me, practise an answer."
1365,Henry IV,141,2.4.359,"Do thou stand for my father, and examine me upon the"
1366,Henry IV,141,2.4.360,particulars of my life.
1367,Henry IV,142,2.4.361,"Shall I? content: this chair shall be my state,"
1368,Henry IV,142,2.4.362,"this dagger my sceptre, and this cushion my crown."
1369,Henry IV,143,2.4.363,"Thy state is taken for a joined-stool, thy golden"
1370,Henry IV,143,2.4.364,"sceptre for a leaden dagger, and thy precious rich"
1371,Henry IV,143,2.4.365,crown for a pitiful bald crown!
1372,Henry IV,144,2.4.366,"Well, an the fire of grace be not quite out of thee,"
1373,Henry IV,144,2.4.367,now shalt thou be moved. Give me a cup of sack to
1374,Henry IV,144,2.4.368,"make my eyes look red, that it may be thought I have"
1375,Henry IV,144,2.4.369,"wept, for I must speak in passion, and I will do it"
1376,Henry IV,144,2.4.370,in King Cambyses' vein.
1377,Henry IV,145,2.4.371,"Well, here is my leg."
1378,Henry IV,146,2.4.372,"And here is my speech. Stand aside, nobility."
1379,Henry IV,147,2.4.373,"O Jesu, this is excellent sport, i' faith!"
1380,Henry IV,148,2.4.374,"Weep not, sweet queen, for trickling tears are vain."
1381,Henry IV,149,2.4.375,"O, the father, how he holds his countenance!"
1382,Henry IV,150,2.4.376,"For God's sake, lords, convey my tristful queen,"
1383,Henry IV,150,2.4.377,For tears do stop the flood-gates of her eyes.
1384,Henry IV,151,2.4.378,"O Jesu, he doth it as like one of these harlotry"
1385,Henry IV,151,2.4.379,players as ever I see!
1386,Henry IV,152,2.4.380,"Peace, good pint-pot, peace, good tickle-brain."
1387,Henry IV,152,2.4.381,"Harry, I do not only marvel where thou spendest thy"
1388,Henry IV,152,2.4.382,"time, but also how thou art accompanied: for though"
1389,Henry IV,152,2.4.383,"the camomile, the more it is trodden on the faster"
1390,Henry IV,152,2.4.384,"it grows, yet youth, the more it is wasted the"
1391,Henry IV,152,2.4.385,"sooner it wears. That thou art my son, I have"
1392,Henry IV,152,2.4.386,"partly thy mother's word, partly my own opinion,"
1393,Henry IV,152,2.4.387,but chiefly a villanous trick of thine eye and a
1394,Henry IV,152,2.4.388,"foolish-hanging of thy nether lip, that doth warrant"
1395,Henry IV,152,2.4.389,"me. If then thou be son to me, here lies the point,"
1396,Henry IV,152,2.4.390,"why, being son to me, art thou so pointed at? Shall"
1397,Henry IV,152,2.4.391,the blessed sun of heaven prove a micher and eat
1398,Henry IV,152,2.4.392,blackberries? a question not to be asked. Shall
1399,Henry IV,152,2.4.393,the sun of England prove a thief and take purses? a
1400,Henry IV,152,2.4.394,"question to be asked. There is a thing, Harry,"
1401,Henry IV,152,2.4.395,which thou hast often heard of and it is known to
1402,Henry IV,152,2.4.396,"many in our land by the name of pitch: this pitch,"
1403,Henry IV,152,2.4.397,"as ancient writers do report, doth defile, so doth"
1404,Henry IV,152,2.4.398,"the company thou keepest: for, Harry, now I do not"
1405,Henry IV,152,2.4.399,"speak to thee in drink but in tears, not in"
1406,Henry IV,152,2.4.400,"pleasure but in passion, not in words only, but in"
1407,Henry IV,152,2.4.401,woes also: and yet there is a virtuous man whom I
1408,Henry IV,152,2.4.402,"have often noted in thy company, but I know not his name."
1409,Henry IV,153,2.4.403,"What manner of man, an it like your majesty?"
1410,Henry IV,154,2.4.404,"A goodly portly man, i' faith, and a corpulent, of a"
1411,Henry IV,154,2.4.405,"cheerful look, a pleasing eye and a most noble"
1412,Henry IV,154,2.4.406,"carriage, and, as I think, his age some fifty, or,"
1413,Henry IV,154,2.4.407,"by'r lady, inclining to three score, and now I"
1414,Henry IV,154,2.4.408,"remember me, his name is Falstaff: if that man"
1415,Henry IV,154,2.4.409,"should be lewdly given, he deceiveth me, for, Harry,"
1416,Henry IV,154,2.4.410,I see virtue in his looks. If then the tree may be
1417,Henry IV,154,2.4.411,"known by the fruit, as the fruit by the tree, then,"
1418,Henry IV,154,2.4.412,"peremptorily I speak it, there is virtue in that"
1419,Henry IV,154,2.4.413,"Falstaff: him keep with, the rest banish. And tell"
1420,Henry IV,154,2.4.414,"me now, thou naughty varlet, tell me, where hast"
1421,Henry IV,154,2.4.415,thou been this month?
1422,Henry IV,155,2.4.416,"Dost thou speak like a king? Do thou stand for me,"
1423,Henry IV,155,2.4.417,and I'll play my father.
1424,Henry IV,156,2.4.418,"Depose me? if thou dost it half so gravely, so"
1425,Henry IV,156,2.4.419,"majestically, both in word and matter, hang me up by"
1426,Henry IV,156,2.4.420,the heels for a rabbit-sucker or a poulter's hare.
1427,Henry IV,157,2.4.421,"Well, here I am set."
1428,Henry IV,158,2.4.422,"And here I stand: judge, my masters."
1429,Henry IV,159,2.4.423,"Now, Harry, whence come you?"
1430,Henry IV,160,2.4.424,"My noble lord, from Eastcheap."
1431,Henry IV,161,2.4.425,The complaints I hear of thee are grievous.
1432,Henry IV,162,2.4.426,"'Sblood, my lord, they are false: nay, I'll tickle"
1433,Henry IV,162,2.4.427,"ye for a young prince, i' faith."
1434,Henry IV,163,2.4.428,"Swearest thou, ungracious boy? henceforth ne'er look"
1435,Henry IV,163,2.4.429,on me. Thou art violently carried away from grace:
1436,Henry IV,163,2.4.430,there is a devil haunts thee in the likeness of an
1437,Henry IV,163,2.4.431,"old fat man, a tun of man is thy companion. Why"
1438,Henry IV,163,2.4.432,"dost thou converse with that trunk of humours, that"
1439,Henry IV,163,2.4.433,"bolting-hutch of beastliness, that swollen parcel"
1440,Henry IV,163,2.4.434,"of dropsies, that huge bombard of sack, that stuffed"
1441,Henry IV,163,2.4.435,"cloak-bag of guts, that roasted Manningtree ox with"
1442,Henry IV,163,2.4.436,"the pudding in his belly, that reverend vice, that"
1443,Henry IV,163,2.4.437,"grey iniquity, that father ruffian, that vanity in"
1444,Henry IV,163,2.4.438,"years? Wherein is he good, but to taste sack and"
1445,Henry IV,163,2.4.439,"drink it? wherein neat and cleanly, but to carve a"
1446,Henry IV,163,2.4.440,"capon and eat it? wherein cunning, but in craft?"
1447,Henry IV,163,2.4.441,"wherein crafty, but in villany? wherein villanous,"
1448,Henry IV,163,2.4.442,"but in all things? wherein worthy, but in nothing?"
1449,Henry IV,164,2.4.443,I would your grace would take me with you: whom
1450,Henry IV,164,2.4.444,means your grace?
1451,Henry IV,165,2.4.445,"That villanous abominable misleader of youth,"
1452,Henry IV,165,2.4.446,"Falstaff, that old white-bearded Satan."
1453,Henry IV,166,2.4.447,"My lord, the man I know."
1454,Henry IV,167,2.4.448,I know thou dost.
1455,Henry IV,168,2.4.449,"But to say I know more harm in him than in myself,"
1456,Henry IV,168,2.4.450,"were to say more than I know. That he is old, the"
1457,Henry IV,168,2.4.451,"more the pity, his white hairs do witness it, but"
1458,Henry IV,168,2.4.452,"that he is, saving your reverence, a whoremaster,"
1459,Henry IV,168,2.4.453,"that I utterly deny. If sack and sugar be a fault,"
1460,Henry IV,168,2.4.454,God help the wicked! if to be old and merry be a
1461,Henry IV,168,2.4.455,"sin, then many an old host that I know is damned: if"
1462,Henry IV,168,2.4.456,"to be fat be to be hated, then Pharaoh's lean kine"
1463,Henry IV,168,2.4.457,"are to be loved. No, my good lord, banish Peto,"
1464,Henry IV,168,2.4.458,"banish Bardolph, banish Poins: but for sweet Jack"
1465,Henry IV,168,2.4.459,"Falstaff, kind Jack Falstaff, true Jack Falstaff,"
1466,Henry IV,168,2.4.460,"valiant Jack Falstaff, and therefore more valiant,"
1467,Henry IV,168,2.4.461,"being, as he is, old Jack Falstaff, banish not him"
1468,Henry IV,168,2.4.462,"thy Harry's company, banish not him thy Harry's"
1469,Henry IV,168,2.4.463,"company: banish plump Jack, and banish all the world."
1470,Henry IV,169,2.4.464,"I do, I will."
1471,Henry IV,169,,A knocking heard
1472,Henry IV,169,,"Exeunt Hostess, FRANCIS, and BARDOLPH"
1473,Henry IV,169,,"Re-enter BARDOLPH, running"
1474,Henry IV,170,2.4.465,"O, my lord, my lord! the sheriff with a most"
1475,Henry IV,170,2.4.466,monstrous watch is at the door.
1476,Henry IV,171,2.4.467,"Out, ye rogue! Play out the play: I have much to"
1477,Henry IV,171,2.4.468,say in the behalf of that Falstaff.
1478,Henry IV,171,,Re-enter the Hostess
1479,Henry IV,172,2.4.469,"O Jesu, my lord, my lord!"
1480,Henry IV,173,2.4.470,"Heigh, heigh! the devil rides upon a fiddlestick:"
1481,Henry IV,173,2.4.471,what's the matter?
1482,Henry IV,174,2.4.472,The sheriff and all the watch are at the door: they
1483,Henry IV,174,2.4.473,are come to search the house. Shall I let them in?
1484,Henry IV,175,2.4.474,"Dost thou hear, Hal? never call a true piece of"
1485,Henry IV,175,2.4.475,"gold a counterfeit: thou art essentially mad,"
1486,Henry IV,175,2.4.476,without seeming so.
1487,Henry IV,176,2.4.477,"And thou a natural coward, without instinct."
1488,Henry IV,177,2.4.478,"I deny your major: if you will deny the sheriff,"
1489,Henry IV,177,2.4.479,"so, if not, let him enter: if I become not a cart"
1490,Henry IV,177,2.4.480,"as well as another man, a plague on my bringing up!"
1491,Henry IV,177,2.4.481,I hope I shall as soon be strangled with a halter as another.
1492,Henry IV,178,2.4.482,"Go, hide thee behind the arras: the rest walk up"
1493,Henry IV,178,2.4.483,"above. Now, my masters, for a true face and good"
1494,Henry IV,178,2.4.484,conscience.
1495,Henry IV,179,2.4.485,"Both which I have had: but their date is out, and"
1496,Henry IV,179,2.4.486,therefore I'll hide me.
1497,Henry IV,180,2.4.487,Call in the sheriff.
1498,Henry IV,180,,Exeunt all except PRINCE HENRY and PETO
1499,Henry IV,180,,Enter Sheriff and the Carrier
1500,Henry IV,180,2.4.488,"Now, master sheriff, what is your will with me?"
1501,Henry IV,181,2.4.489,"First, pardon me, my lord. A hue and cry"
1502,Henry IV,181,2.4.490,Hath follow'd certain men unto this house.
1503,Henry IV,182,2.4.491,What men?
1504,Henry IV,183,2.4.492,"One of them is well known, my gracious lord,"
1505,Henry IV,183,2.4.493,A gross fat man.
1506,Henry IV,184,2.4.494,As fat as butter.
1507,Henry IV,185,2.4.495,"The man, I do assure you, is not here,"
1508,Henry IV,185,2.4.496,For I myself at this time have employ'd him.
1509,Henry IV,185,2.4.497,"And, sheriff, I will engage my word to thee"
1510,Henry IV,185,2.4.498,"That I will, by to-morrow dinner-time,"
1511,Henry IV,185,2.4.499,"Send him to answer thee, or any man,"
1512,Henry IV,185,2.4.500,For any thing he shall be charged withal:
1513,Henry IV,185,2.4.501,And so let me entreat you leave the house.
1514,Henry IV,186,2.4.502,"I will, my lord. There are two gentlemen"
1515,Henry IV,186,2.4.503,Have in this robbery lost three hundred marks.
1516,Henry IV,187,2.4.504,"It may be so: if he have robb'd these men,"
1517,Henry IV,187,2.4.505,"He shall be answerable, and so farewell."
1518,Henry IV,188,2.4.506,"Good night, my noble lord."
1519,Henry IV,189,2.4.507,"I think it is good morrow, is it not?"
1520,Henry IV,190,2.4.508,"Indeed, my lord, I think it be two o'clock."
1521,Henry IV,190,,Exeunt Sheriff and Carrier
1522,Henry IV,191,2.4.509,"This oily rascal is known as well as Paul's. Go,"
1523,Henry IV,191,2.4.510,call him forth.
1524,Henry IV,192,2.4.511,"Falstaff!--Fast asleep behind the arras, and"
1525,Henry IV,192,2.4.512,snorting like a horse.
1526,Henry IV,193,2.4.513,"Hark, how hard he fetches breath. Search his pockets."
1527,Henry IV,193,,"He searcheth his pockets, and findeth certain papers"
1528,Henry IV,193,2.4.514,What hast thou found?
1529,Henry IV,194,2.4.515,"Nothing but papers, my lord."
1530,Henry IV,195,2.4.516,Let's see what they be: read them.
1531,Henry IV,196,2.4.517,"[Reads]  Item, A capon,. . 2s. 2d."
1532,Henry IV,196,2.4.518,"Item, Sauce,. . . 4d."
1533,Henry IV,196,2.4.519,"Item, Sack, two gallons, 5s. 8d."
1534,Henry IV,196,2.4.520,"Item, Anchovies and sack after supper, 2s. 6d."
1535,Henry IV,196,2.4.521,"Item, Bread,        ob."
1536,Henry IV,197,2.4.522,O monstrous! but one half-penny-worth of bread to
1537,Henry IV,197,2.4.523,"this intolerable deal of sack! What there is else,"
1538,Henry IV,197,2.4.524,"keep close, we'll read it at more advantage: there"
1539,Henry IV,197,2.4.525,let him sleep till day. I'll to the court in the
1540,Henry IV,197,2.4.526,"morning. We must all to the wars, and thy place"
1541,Henry IV,197,2.4.527,shall be honourable. I'll procure this fat rogue a
1542,Henry IV,197,2.4.528,"charge of foot, and I know his death will be a"
1543,Henry IV,197,2.4.529,march of twelve-score. The money shall be paid
1544,Henry IV,197,2.4.530,back again with advantage. Be with me betimes in
